<?xml version="1.0" encoding="UTF-8"?>
<xs:schema xmlns:xs="http://www.w3.org/2001/XMLSchema">
    <xs:element name="prueba_regex">
        <xs:complexType>
            <xs:sequence>
                <xs:element name="valor" maxOccurs="unbounded">
                <xs:simpleType>
                    <xs:restriction base="xs:string">
                        <xs:pattern value="([A-Z][a-z])*[A-Z]?"/>
                        <xs:maxLength value="10"/>
                        <xs:minLength value="3"/>
                    </xs:restriction>
                </xs:simpleType>
                </xs:element>
            </xs:sequence>
        </xs:complexType>
    </xs:element>
</xs:schema>